----------------------------------------------------------------------------
CrystalDiskInfo 8.12.2 (C) 2008-2021 hiyohiyo
                                Crystal Dew World: https://crystalmark.info/
----------------------------------------------------------------------------

    OS : Windows 10 Enterprise [10.0 Build 19041] (x64)
  Date : 2025/01/10 16:40:05

-- Controller Map ----------------------------------------------------------
 - Microsoft iSCSI Initiator [SCSI]
 + RAID Controller [SCSI]
   - ATA HL-DT-ST DVD+/-RW GH70N
   - ST1000DM010-2EP102
   - Intel(R) Optane(TM) Pinning Shell Extensions
   - Intel(R) Optane(TM) Pinning Shell Extensions
   - Intel(R) Optane(TM) Memory and Storage Management Component
 - Microsoft Storage Spaces Controller [SCSI]
 + Microsoft VHD Loopback Controller [SCSI]
   - Microsoft Virtual DVD-ROM

-- Disk List ---------------------------------------------------------------
 (01) ST1000DM010-2EP102 : 1000.2 GB [0/0/1, pd1]

----------------------------------------------------------------------------
 (01) ST1000DM010-2EP102
----------------------------------------------------------------------------
           Model : ST1000DM010-2EP102
        Firmware : CC43
   Serial Number : ZN10SMM4
       Disk Size : 1000.2 GB (8.4/137.4/1000.2/----)
     Buffer Size : Unknown
     Queue Depth : 32
    # of Sectors : 1953525168
   Rotation Rate : 7200 RPM
       Interface : Serial ATA
   Major Version : ATA8-ACS
   Minor Version : ATA8-ACS version 4
   Transfer Mode : SATA/600 | SATA/600
  Power On Hours : 15179 hours
  Power On Count : 2325 count
     Temperature : 38 C (100 F)
   Health Status : Good
        Features : S.M.A.R.T., APM, NCQ
       APM Level : 8080h [ON]
       AAM Level : ----
    Drive Letter : C:

-- S.M.A.R.T. --------------------------------------------------------------
ID Cur Wor Thr RawValues(6) Attribute Name
01 _83 _54 __6 00000D503D8A Read Error Rate
03 _97 _96 __0 000000000000 Spin-Up Time
04 _97 _97 _20 000000000CE1 Start/Stop Count
05 100 100 _10 000000000000 Reallocated Sectors Count
07 _83 _60 _45 00000C0CBD0A Seek Error Rate
09 _83 _83 __0 000000003B4B Power-On Hours
0A 100 100 _97 000000000000 Spin Retry Count
0C _98 _98 _20 000000000915 Power Cycle Count
B7 100 100 __0 000000000000 Vendor Specific
B8 100 100 _99 000000000000 End-to-End Error
BB __1 __1 __0 00000000070B Reported Uncorrectable Errors
BC 100 100 __0 000000000001 Command Timeout
BD 100 100 __0 000000000000 High Fly Writes
BE _62 _53 _40 000026250026 Airflow Temperature
C1 _99 _99 __0 000000000CE8 Load/Unload Cycle Count
C2 _38 __5 __0 000500000026 Temperature
C3 __1 __1 __0 00000D503D8A Hardware ECC recovered
C5 100 100 __0 000000000000 Current Pending Sector Count
C6 100 100 __0 000000000000 Uncorrectable Sector Count
C7 200 200 __0 000000000000 UltraDMA CRC Error Count
F0 100 253 __0 84F300003949 Head Flying Hours
F1 100 253 __0 0009155ED454 Total Host Writes
F2 100 253 __0 0004F38A1109 Total Host Reads

-- IDENTIFY_DEVICE ---------------------------------------------------------
        0    1    2    3    4    5    6    7    8    9
000: 0C5A 3FFF C837 0010 0000 0000 003F 0000 0000 0000
010: 2020 2020 2020 2020 2020 2020 5A4E 3130 534D 4D34
020: 0000 0000 0000 4343 3433 2020 2020 5354 3130 3030
030: 444D 3031 302D 3245 5031 3032 2020 2020 2020 2020
040: 2020 2020 2020 2020 2020 2020 2020 8010 4000 2F00
050: 4000 0200 0200 0007 3FFF 0010 003F FC10 00FB 0110
060: FFFF 0FFF 0000 0007 0003 0078 0078 0078 0078 0000
070: 0000 0000 0000 0000 0000 001F 850E 0006 00CC 004C
080: 01F0 0029 346B 7D69 4163 3469 BC49 4163 407F 0034
090: 0034 8080 FFFE 0000 D0D0 0000 0000 0000 0000 0000
100: 6DB0 7470 0000 0000 0000 0000 6003 0000 5000 C500
110: B3B1 FC6A 0000 0000 0000 0000 0000 0000 0000 401E
120: 401C 0000 0000 0000 0000 0000 0000 0000 0029 6DB0
130: 7470 6DB0 7470 2020 0002 0140 0100 5000 3C06 3C0A
140: 0000 003C 0000 0008 0000 0000 FDFF 0280 0000 0000
150: 0008 0000 0000 0000 0000 8000 0000 0184 9400 8000
160: 0000 0000 0000 0000 0000 0000 0000 0000 0002 0000
170: 0000 0000 0000 0000 0000 0000 0000 0000 0000 0000
180: 0000 0000 0000 0000 0000 0000 0000 0000 0000 0000
190: 0000 0000 0000 0000 0000 0000 0000 0000 0000 0000
200: 0000 0000 0000 0000 0000 0000 1085 0000 0000 4000
210: 0000 0000 0000 0000 0000 0000 0000 1C20 0000 0000
220: 0000 0000 1020 0000 0000 0000 0000 0000 0000 0000
230: 0000 0000 0000 0000 0000 0000 0000 0000 0000 0000
240: 0000 0000 0000 0000 0000 0000 0000 0000 0000 0000
250: 0000 0000 0000 0000 0000 D5A5

-- SMART_READ_DATA ---------------------------------------------------------
     +0 +1 +2 +3 +4 +5 +6 +7 +8 +9 +A +B +C +D +E +F
000: 0A 00 01 0F 00 53 36 8A 3D 50 0D 00 00 00 03 03
010: 00 61 60 00 00 00 00 00 00 00 04 32 00 61 61 E1
020: 0C 00 00 00 00 00 05 33 00 64 64 00 00 00 00 00
030: 00 00 07 0F 00 53 3C 0A BD 0C 0C 00 00 00 09 32
040: 00 53 53 4B 3B 00 00 00 00 00 0A 13 00 64 64 00
050: 00 00 00 00 00 00 0C 32 00 62 62 15 09 00 00 00
060: 00 00 B7 32 00 64 64 00 00 00 00 00 00 00 B8 32
070: 00 64 64 00 00 00 00 00 00 00 BB 32 00 01 01 0B
080: 07 00 00 00 00 00 BC 32 00 64 64 01 00 00 00 00
090: 00 00 BD 3A 00 64 64 00 00 00 00 00 00 00 BE 22
0A0: 00 3E 35 26 00 25 26 00 00 00 C1 32 00 63 63 E8
0B0: 0C 00 00 00 00 00 C2 22 00 26 05 26 00 00 00 05
0C0: 00 00 C3 1A 00 01 01 8A 3D 50 0D 00 00 00 C5 12
0D0: 00 64 64 00 00 00 00 00 00 00 C6 10 00 64 64 00
0E0: 00 00 00 00 00 00 C7 3E 00 C8 C8 00 00 00 00 00
0F0: 00 00 F0 00 00 64 FD 49 39 00 00 F3 84 28 F1 00
100: 00 64 FD 54 D4 5E 15 09 00 00 F2 00 00 64 FD 09
110: 11 8A F3 04 00 00 00 00 00 00 00 00 00 00 00 00
120: 00 00 00 00 00 00 00 00 00 00 00 00 00 00 00 00
130: 00 00 00 00 00 00 00 00 00 00 00 00 00 00 00 00
140: 00 00 00 00 00 00 00 00 00 00 00 00 00 00 00 00
150: 00 00 00 00 00 00 00 00 00 00 00 00 00 00 00 00
160: 00 00 00 00 00 00 00 00 00 00 00 00 00 00 00 73
170: 03 00 01 00 01 68 02 00 00 00 00 00 00 00 00 00
180: 00 00 00 00 00 00 00 00 02 03 03 03 03 03 03 03
190: 03 00 00 00 00 00 00 00 00 01 00 00 00 00 00 00
1A0: 00 00 00 00 00 00 00 00 7B E7 97 61 B3 31 00 00
1B0: 00 00 00 00 01 00 00 07 54 D4 5E 15 09 00 00 00
1C0: 09 11 8A F3 04 00 00 00 00 00 00 00 F6 E9 79 0C
1D0: 00 00 00 00 00 00 00 00 F8 01 00 00 06 00 00 00
1E0: 00 00 00 00 21 00 00 00 00 00 00 00 00 00 00 06
1F0: 00 00 00 00 00 00 00 00 00 00 14 17 00 00 00 B6

-- SMART_READ_THRESHOLD ----------------------------------------------------
     +0 +1 +2 +3 +4 +5 +6 +7 +8 +9 +A +B +C +D +E +F
000: 01 00 01 06 00 00 00 00 00 00 00 00 00 00 03 00
010: 00 00 00 00 00 00 00 00 00 00 04 14 00 00 00 00
020: 00 00 00 00 00 00 05 0A 00 00 00 00 00 00 00 00
030: 00 00 07 2D 00 00 00 00 00 00 00 00 00 00 09 00
040: 00 00 00 00 00 00 00 00 00 00 0A 61 00 00 00 00
050: 00 00 00 00 00 00 0C 14 00 00 00 00 00 00 00 00
060: 00 00 B7 00 00 00 00 00 00 00 00 00 00 00 B8 63
070: 00 00 00 00 00 00 00 00 00 00 BB 00 00 00 00 00
080: 00 00 00 00 00 00 BC 00 00 00 00 00 00 00 00 00
090: 00 00 BD 00 00 00 00 00 00 00 00 00 00 00 BE 28
0A0: 00 00 00 00 00 00 00 00 00 00 C1 00 00 00 00 00
0B0: 00 00 00 00 00 00 C2 00 00 00 00 00 00 00 00 00
0C0: 00 00 C3 00 00 00 00 00 00 00 00 00 00 00 C5 00
0D0: 00 00 00 00 00 00 00 00 00 00 C6 00 00 00 00 00
0E0: 00 00 00 00 00 00 C7 00 00 00 00 00 00 00 00 00
0F0: 00 00 F0 00 00 00 00 00 00 00 00 00 00 00 F1 00
100: 00 00 00 00 00 00 00 00 00 00 F2 00 00 00 00 00
110: 00 00 00 00 00 00 00 00 00 00 00 00 00 00 00 00
120: 00 00 00 00 00 00 00 00 00 00 00 00 00 00 00 00
130: 00 00 00 00 00 00 00 00 00 00 00 00 00 00 00 00
140: 00 00 00 00 00 00 00 00 00 00 00 00 00 00 00 00
150: 00 00 00 00 00 00 00 00 00 00 00 00 00 00 00 00
160: 00 00 00 00 00 00 00 00 00 00 00 00 00 00 00 00
170: 00 00 00 00 00 00 00 00 00 00 00 00 00 00 00 00
180: 00 00 00 00 00 00 00 00 00 00 00 00 00 00 00 00
190: 00 00 00 00 00 00 00 00 00 00 00 00 00 00 00 00
1A0: 00 00 00 00 00 00 00 00 00 00 00 00 00 00 00 00
1B0: 00 00 00 00 00 00 00 00 00 00 00 00 00 00 00 00
1C0: 00 00 00 00 00 00 00 00 00 00 00 00 00 00 00 00
1D0: 00 00 00 00 00 00 00 00 00 00 00 00 00 00 00 00
1E0: 00 00 00 00 00 00 00 00 00 00 00 00 00 00 00 00
1F0: 00 00 00 00 00 00 00 00 00 00 00 00 00 00 00 AF

